{
  "record_id": "ap:AP-0033",
  "source": "atlas",
  "source_id": "AML.CS0039",
  "schema_version": "1.0",
  "ingest_date": "2026-06-06T12:00:00Z",
  "title": "External support ticket is laundered through a workflow connector into privileged AI-agent actions",
  "description": "An AI agent is embedded in an enterprise service-management workflow, processing support tickets with the standing internal trust and privileges of that workflow. An external user submits a ticket whose body carries instructions rather than a genuine request. When the ticket is later processed by the agent (automatically, or on an internal user's behalf), the connector-delivered ticket content is interpreted as authoritative workflow input, and the agent carries out the embedded instructions with elevated privileges. The trust boundary collapses because content authored by an untrusted external requester inherits the internal trust of the workflow it enters.",
  "attack_narrative": "The attacker files a support ticket that looks routine but embeds an imperative aimed at the downstream AI agent. The service-management connector routes the ticket into the agent's context as normal queued work; the agent, operating with the workflow's internal permissions, does not distinguish the external requester's prose from a legitimate internal instruction. It then performs privileged actions the requester chose — reading restricted data, changing configuration, or chaining further tool calls — under the workflow's own identity. The 'living off AI' pattern is that the attacker supplies no infrastructure of their own; they borrow the trusted agent's privileges by injecting through the intake channel everyone is expected to use.",
  "failure_class": [
    "indirect-prompt-injection",
    "excessive-agency",
    "unauthorized-tool-invocation"
  ],
  "target_surface": "enterprise-workflow-agent/ticket-connector",
  "trust_boundary": "connector-context-confabulation",
  "tactic": "Privilege Escalation",
  "technique_id": "AML.T0051.001",
  "technique_name": "LLM Prompt Injection: Indirect",
  "escalation_mechanism": "A service-management connector hands an externally-authored ticket to an agent that runs with the workflow's internal privileges; the agent treats the requester's instructions as trusted work and executes them with elevated access.",
  "kill_chain_stage": "trust-boundary-collapse",
  "severity": "high",
  "cwe_ids": [],
  "cve_ids": [],
  "failure_signal": "The agent performs a privileged internal action whose only instruction source is the free-text body of an externally-submitted support ticket.",
  "impact_statement": "An unauthenticated external requester induces a trusted internal AI agent to perform privileged actions — data access, configuration change, or further tool calls — under the organisation's own identity.",
  "mitigation_themes": [
    "external-input-trust-segregation",
    "agent-privilege-least-authority",
    "human-confirmation-on-privileged-tool-calls"
  ],
  "human_in_loop": false,
  "user_actions_in_attack_chain": [],
  "preconditions": [
    "passive:an AI agent processes externally-submitted tickets with internal workflow privileges",
    "active:attacker submits a crafted support ticket"
  ],
  "precondition_weight": "light",
  "permission_mode": "default",
  "consequential_action": "tool-call-chain",
  "harm_layer": "durable-side-effect",
  "outcome": "privilege-escalation",
  "expected_behavior_exit": false,
  "vendor_disposition": "unknown",
  "program": "none",
  "scope_snapshot_date": "2026-06-06",
  "scope_tag": "unknown",
  "sensitivity": "public",
  "domain": "ai_native",
  "auto_classified": false,
  "verified": true,
  "use_for_rag": true,
  "raw_ref": "atlas.mitre.org/studies/AML.CS0039",
  "license": "Apache-2.0; MITRE ATLAS case study AML.CS0039 (c) The MITRE Corporation"
}
