{
  "record_id": "ap:AP-0026",
  "source": "atlas",
  "source_id": "AML.CS0024",
  "schema_version": "1.0",
  "ingest_date": "2026-06-04T09:59:48Z",
  "title": "Self-replicating prompt (RAG worm) propagates across email assistants and leaks private data",
  "description": "A RAG-based email assistant automatically ingests received messages, retrieves prior correspondence, and drafts replies. A zero-click worm is delivered as an email carrying an adversarial self-replicating prompt: when processed, the prompt instructs the assistant to reproduce the prompt itself in its output AND to include sensitive user data. Because the self-replicating text lands back in the retrieval database, future requests re-surface it, propagating the worm to onward correspondents while continuously leaking private information. The durable RAG store is the persistence and propagation medium.",
  "attack_narrative": "The attacker sends a single seed email. Auto-ingestion places the self-replicating prompt into the assistant's retrieval corpus. On the next reply-generation, retrieval pulls the malicious entry, the model both re-emits the replicating payload and appends exfiltrated data, and the outgoing message carries the worm to the next system. No user action beyond normal mail flow is needed for replication.",
  "failure_class": [
    "self-replicating-prompt-injection",
    "rag-poisoning",
    "data-exfiltration"
  ],
  "target_surface": "rag-email-assistant/auto-reply",
  "trust_boundary": "other",
  "tactic": "Persistence",
  "technique_id": "AML.T0061",
  "technique_name": "LLM Prompt Self-Replication",
  "escalation_mechanism": "Self-replicating prompt re-enters the retrieval store on each cycle; retrieval re-surfaces it, giving cross-system propagation plus per-cycle data leakage.",
  "kill_chain_stage": "durable-persistence",
  "severity": "high",
  "cwe_ids": [],
  "cve_ids": [],
  "failure_signal": "An ingested message reappears verbatim in generated replies and the retrieval store, and outgoing drafts carry both the replicating text and private data.",
  "impact_statement": "Persistent, self-propagating compromise of connected GenAI email systems with continuous leakage of private correspondence — no per-message user interaction required.",
  "mitigation_themes": [
    "retrieval-write-provenance",
    "output-as-future-input-containment",
    "self-replication-detection"
  ],
  "human_in_loop": false,
  "user_actions_in_attack_chain": [],
  "preconditions": [
    "passive:assistant auto-ingests received mail and auto-drafts replies from retrieval"
  ],
  "precondition_weight": "light",
  "permission_mode": "default",
  "consequential_action": "memory-write",
  "harm_layer": "durable-side-effect",
  "outcome": "data-exfil",
  "expected_behavior_exit": false,
  "vendor_disposition": "unknown",
  "program": "none",
  "scope_snapshot_date": "2026-06-04",
  "scope_tag": "unknown",
  "sensitivity": "public",
  "domain": "ai_native",
  "auto_classified": false,
  "verified": true,
  "use_for_rag": true,
  "raw_ref": "atlas.mitre.org/studies/AML.CS0024",
  "license": "Apache-2.0; MITRE ATLAS case study AML.CS0024 (c) The MITRE Corporation"
}